Even if I was interested in this, the name is so terrible it would have immediately put me off.	They were trying for the same vibe as those Hourglass Lip Stylos ("Activist", "Peacemaker", "Achiever") and inspirational quote posters, but ended up sounding like they couldn't decide which YouTuber to collaborate with.
Honestly this part of the game is infuriating, it should be a push pull capture.  If you have more people, you should still be securing the point.	I thought that too when the game first came out. But the objectives are so small I feel like it'd be impossible for defenders to do anything. Attackers could just swarm on top of the objective without actually clearing it.
Marshall makes some in the style as that 	Hmm where would that be? Went to their in-ear section but only found two pairs, none with this design. https://www.marshallheadphones.com/mh_se_en/headphones/in-ear Thank you!
My OHP strength varies a lot session to session. Any tips on being consistent on OHP? 	Consistent technique and good rest.
Im feeling that they become models instead of musicians. Still no info on new music...	Blackpink in your area taking pictures
You can buy/rent a subscription that'll give you dailies that give 20 coins, +50% resources limit and rep gain. It's basically a booster if you want to level and progress faster.	did they tell us if after the Open Beta they will reset Lvl and stats to 0 ? Cause buying a Boost for Rep in a beta is pretty stupid if they Reset when the game officialy launch  
Choose the slowest cart and the heaviest character. That is what I do to try and even the odds	The heaviest character makes your top speed higher. I would say choose the lightest (baby) characters and a kart with low speed.
no!!!1!1’	 &gt; 1! 1! = 1 
V (and somewhat saeran by extension) would listen to artsy acoustic music and newgrass.	Feels like he would like indie 
Guess I will add an explanation 😐. My girlfriend was in the kitchen flattening chicken with a pan on a cutting board.	Oh good. it sounded like you were hitting a snare drum and I was like, stop it!
Ayy girlfriend got me the same thing for Valentines Day. Hoping the weather gets nice again soon so we can launch it 	Good luck with the launch, and great work to your gf she obviously knows you well 
http://www.abc.net.au/news/2018-03-05/retail-food-group-shares-plunge-on-store-closures/9509156 A lot of chains are now owing the bank a lot of cash. Housing is next and prices wilk start coming down a little.	Can’t wait 
Thankgod there’s still people talking about this series, it’s my legitimately my facoeire	Mine too bud. Mine too.
Traded artisans with /u/DarwinMcLovin	Confirmed! 
It’s missing The Days (Avicii by Avicii) in the unreleased section. Played at EDC Las Vegas 2015	It is there, labeled as WIP #1. I'm not 100% sure it is Avicii by Avicii.
YESSSS CU ALTER IS HERE and will get his banner in one-two months which gives me more time to save.	So we got barely a month between Jalter and Cu Alter?
Was there with the band. Theres no way to explain how much the crowd was a factor in this game.  This was a home game for Charleston. They got loud and stayed loud in the second half and definitely got to our players. Miscommunication, silly mistakes etc. I'm disappointed especially after doing so well in the first half but I'm also proud of how well this team performed this year. 	I thought the band sounded good listening on WRBB. Did arrangements change? Songs sounded fuller.
[Jonerys Forever. Forever Jonerys](http://img2.thejournal.ie/inline/2188903/original?width=457&amp;version=2188903)	Now THAT is a song I would jam to.
Anton's is my favorite. Stock Hill, The Majestic, J. Alexander's, 801 Chophouse and Rye are all excellent as well.	Second on stock hill. Went there for restaurant week and my steak was fantastic. 
What can we do to fix this?	literally nothing at this point. we can “clean up” but its too much and its likely people will ask and pretend but wont even actually do it 
I like the window and the background apereately but i feel they dont work too well together. Maybe drop the brightness of the window	I was about say the same thing.
They’re gonna install a slingshot ride between the minarets and charge $5 a ride. 	Thank you very much for a much needed giggle.
Good questions! You did some of your research but wanted to verify. Thanks /u/therandomdude69 for contributing. Hope you love it! I got an XMax V2 Pro and am enjoying it quite a bit. Good choice for a first vaporizer Btw. I expect you'll really enjoy it. 	I do my best to help with things I know 
Site's down :\	I updated, so the file I linked to is gone.  The old version had bugs, the new version is fixed and has multiple improvements. For the current version(s), just check the index page. https://sebwiers.github.io/motorcycle-front-end/
They simply hacked the Gibson.	They're trashing our rights, trashing the flow of data.
That's a nice hot take, but no it helps him. People are staying away from players like Hayden Hurst and Bo Scarbrough because they are 25 already. Being young, and productive, like Edmunds gives teams 0 reason not to take him. He played 2 full seasons in the ACC, he's got enough experience. 	Scarbough only 21...
Neurosurgery I fit in because in my free time I too enjoy cultivating a sense of god-like omnipotence and have trouble dealing with others who dare feign the same aura of god-like omnipotence...	Saw an attending neurosurgeon....he commands respect from everyone in the room
There was a phishing website a couple months ago that was identical to Binance, and it even asked for the 2FA and then there must have been a bot that logged in on the actual binance in the backend realtime using the 2fa that the person entered into the phishing site. Once the phishing site/bot was in my buddy's account. It just sat there and refreshed every 10 minutes to not get logged out. My guess is they implanted themselves in hundreds of accounts and now just did this synchronized buy on VIA	If you login from two different locations doesnt it log out out of the first one?
I never used a bot. I am extremely secure, 100% certain I did not get phished. I have had 2FA on since the first day I signed up. I never activated the API key stuff, never generated a single API key. I , do however, use the mobile app, I believe the attacker obtained access through 1 of 3 things: 1. Phished accounts, enabled API himself &amp; saved the key. 2. Obtained API keys through bots 3. Obtained API key somehow hacking the mobile app backend (this is the only feasible way I could have been hacked). I had BTC on there that just got transferred out directly, no alts but I'm sure if I had alts they would have been sold off and then BTC transferred out like the others.	You can see a withdrawal made on your account?
I pretend that my parents love me for my whole life	That's my favourite game!! Have you hit the level where the main character breaks down and struggles to form strong emotional connection that they don't try to sabotage ? 
[Me desperately bashing refresh on my browser for all the lee changes to load. Moobeat plz.](https://imgur.com/DeY6MaD)	TFW you're supposed to show a reaction gif, but you just wanted to show off mastery score :p
335i by any chance? The N54 engine does tend to go through ignition coils faster than most others engines I know of so your experience wouldn't be too unusual to me. Luckily they're only about $25 a piece and a less than 5 minute job to replace.	It’s a 328i. I paid $60 at the autozone!  I even bought a spare, I guess I got ripped off!  Although I did need them today. So this is pretty normal?  I guess that’s a relief!  Thanks!
Yum cha is my literal favourite.  Dang.  	Dang Yum Cha. That's in the Valley isn't it?
she's KINDA right i guess	Okay, but how are you gonna call yourself a makeup artist when you stay painting the same face everyday? 
I...love...you?	I love you, too! 😙
What is a “Ute”?	That's Aussie for high-performance pick-up truck.
The one with a big City by a lake, everything else is corn though. Former home to a President on currency.	Ohio
I gots my Kumiho, so anytime now is fine.  I'll be selling these extra components soon when I run out of silver. It'd be nice if there was a "Sell All" button.	If you got enough components, you can get the bot and then sell it for silver.
This was already front page when the trailer released a couple months back.	I just saw it yesterday oh well
I personally don't trust anything Buzzfeed puts together. They lack credibility, as far as I am concerned.	Steele dossier? Not credible?
Whole market is overly cautious and wary, general trend is downwards. If the low price of sumo worries you, keep in mind that the coin is very low marketcap which makes it quite volatile. Put your sumo in a wallet and forget about it for a year and you'll come back to 500mil marketcap sumo and that'll be the end of your worries.	I hope you are right! 
Some time had passed too. Because he obviously had decided to take off his jacket.	Take off his jacket? Man’s Not hot 
Something about 6ix	Well since over night is on BT2 that spots already filled 
I miss the type of Naruto episodes that would get my 10 year old self hyped jumping on the bed in excitement. Boruto is like a plain bagel compared to the full 5 star bread and breakfast that Naruto was.	It might have helped that you were 10, I wonder how kids feel about boruto these days? 
This is easily a DDLC anime ending.	I want a DDLC anime
Fat shaming does work, just not all the time. People are wrong in saying it doesn't work. Is it a particularly moral thing to do? Not in my opinion. There are other tactics that work better and more frequently to help a person lose weight and to do it in a healthier manner.	Fat shaming keeps not fat people from getting fat.  It doesn't make fat people lose weight.
Walmart is skimping on floor cleaning cost, no wonder their stuff are cheap, lol	I'm sure all the people in there don't really help things :P
Remember when MBJ was Cyborg?	He could have been a great Cyborg, but no one could have salvaged the role in JL
under armor? 	Kids don’t think UA is cool anymore, jumped the shark with bad mgmt.
Last week I used custom tactics and player instructions for the first time and got 22 wins, the team feels a lot better so I’m hoping for the best  	Good luck!
[Moral relativism] (https://i.redd.it/vb16qorf3yc01.jpg)	But there are lots of things that are right under some circumstances and wrong under other circumstances.  I use examples of this with my kids all the time, like yelling and running on a practice field is great, but is not appropriate in the classroom.  
Mark Twain was scathing in his criticism at the time.	And Teddy Roosevelt called him a traitor for it too.
It's still there. I've seen it last night. 	Really? I've not seen it since, I was sure they removed it for some strange reason.
Fairly disingenuous when you consider that nearly half our net contribution is via VAT and import duties ('traditional own resources' as the EU terms them)	Why does a bigger percentage of VAT and import duties go to the EU? 
I liked this game a lot.  But it's not near as good as people remember.  	No, I played it on the original Wii last year, and it really, really is. It’s my favorite Zelda game.
There are two streams😄 Monday 10:00-13:00 Monday 14:00-17:00	Thank you for the timing. Do you know the location of lecture?
The real question is what outfit he will wear. Im voting for Gerudo Vai top, Barbarian Shorts, and Korok Mask	Snowquill armor would be awesome. 
Bro next time just put them through the dish washer. Duh. Edit: for the record, I was kidding 	I wish this thought wasn't my first millisecond thought on the task. 
I advocate for cameras recording you, the driver, at all times. You're going to need them once they start handing out tickets for changing the radio station or climate.	I've been thinking about it, I have a regular dashcam which faces the front but records sounds inside the vehicle - which is great for those traffic stops! - but I think it's time to invest into one with a view inside the vehicle AND a rear view, too.
Full video: https://www.youtube.com/watch?v=_BNP2y7ELus	Ok, I watched it 6 times now. Just 1 more time...
Another thing to note. If the enemy team is flaming each other in all chat, it's almost guaranteed the game is over and is conceded to you. Call this dirty, but I fuel the flames sometimes and start fights between enemy team members. It's not exactly the most morally correct thing I've ever done, but it has won me some games.	Guilty
I think HubSpot templates are the best.	I use them
So why did they move the price of a seasonal skin up to 660 R6 credits?	Because 20 million+ players and you can't buy exactly 660 credits. You could before buy 600 exactly for 5 bucks. That means spending more money with left over credits for something else.
What was Michael &amp; Jan’s “safe word”?	“foliage” edit: not that jan cares
~~As much as I want to call /r/untrustworthypoptarts on this, I could see it happening IRL.~~ Edit: **NOT** /r/untrustworthypoptarts status [confirmed](https://www.reddit.com/r/smashbros/comments/837una/i_think_my_offices_sunlight_and_shadows_are_also/dvg2a24)	Here's the table that produced it.  https://imgur.com/8ncZ9Sq Definitely happened, definitely my office.  If you really need I can take more pics from different angles when the sun comes back on Monday, haha.
Glengoyne CS is coming back? Slightly interested now.	Seems to be! https://i.imgur.com/E0Z2nvZ.png 
I have a double double ice rain core at epic if you're interested?	I'm interested I need a good ice pet really badly but I cant pay you anything
Hey Ben -- happy to help you get in touch with our discord community. So you've tried clicking on the discord link? https://discord.gg/U6Ub9rr LMK what happens when you do that, and we can go from there :)	You might need to be signed in to your discord account in your web browser to get properly added to our discord server.
LV pochette metis? 	I have a PM but just ordered a SpeedyB 30 too.  The PM is great but very structured so of you we’d to carry water or a book, you may not have room.
Scott would never give a gender to a funtime foxy. *Never*.	That’s what I thought as well
She is still no pertinent news. Stop talking about her	Stay bitter
A bond is money, property and a security.   	Bonds are not legal tender, and as such can’t be considered as “money”.
At previous event you had free useless PTG cards from completing the SBC's. As i remember you could have 4 or even 5 cheap PTG cards. I did them all and spring untradeable SBC is super cheap when you can reroll that useless cards. I did 11 already and im out of useless PTG cards. Packed Willian, Thiago, Sterling, Firmino and Icardi. Incredible luck.	I got Damm 4 times in 6 packs....
If you're not modifying the engine. I would highly recommend going with hot reloads instead of restarting the engine all the time. Engine startup can indeed take quite a while. (Edit: There's probably ways to speed it up. Not an expert there. But I usually just compile my game code and let it hot reload which means a turnaround time of usually less than 30 seconds in my case)	Thanks for your reply. So if I'm not mistaken, what I need to do is as follows: 1) Write my code in VS, 2) Right click on my project, 3) Click "Build" 4) Go to engine and "hot reload"?
At 310 Km/h there is a error message comming in the center gauge cluster. I would bet it could explain the origin of "the noise" over 305... 	Yeah it sounds like a warning sound.
“Natives rising up against their colonisers” DEUS VULT!	THEN THE WINGED HUSSARS ARRIVED
Think I read that Zebo hadn't scored in the six nations since his debut in 2013. Stockdale now has 6 tries in 4 games. Madness.	What did you guys feed Stockdale up there?
Who won the day? 	ABD
I really want Noctua case fans, but they're pretty expensive and never on sale. I need 8 of them. Anyone have ideas? Should I wait longer, go with another brand? The Noctua fans seem so good though... so quiet...	Why do you need 8 case fans?
/r/furry would like a copy of your save file.	/r/furry_irl is huddled in a corner as they aren't used to more than fourteen werewolves at a time. --- /u/andreoidmem said it first oops
I really want the Browns to win a Superbowl or at least become competitive because these daily shit-on-the-Browns posts are getting really old.	It’s a win win for me, I’ll be happy if they’re really good or really bad. They’re really the perfect team. 
I tried changing my diet after seeing my doctor (Doctor of Osteopathic Medicine), and he recommended going gluten free. This is after maybe 2 or 3 weeks between the top left pic and the right. I’ve heard food allergies/intolerances can be a culprit. I later did a food panel and it confirmed a gluten intolerance.	How do you get a food panel done? Is it through your doctor or do you have to seek it out on your own?
I'm surprised that 4 slices were even grabbed.	I mean when you’re vegetarian and that’s the food available to you, that’s what ya eat. Though I would’ve been quite happy with plain old cheese pizza. It’s weird how people think vegetarian = people that want to eat vegetables constantly. 
Is there a science to how quickly tolerance for alcohol goes away?	Are we talking like overall tolerance as in lifetime or just in a smaller sample?
So??? Are you asking for a price check? Or are you searching for a barb torch	I think both
Digusting	Just wondering about your name, what does BBB stand for?
I feel like we are putting too much pressure and emphasis on the fa cup now.	No, the cup is almost essential now. Its so important for the morale of the players and the fans. We have the players, just not the confidence. FA cup this year is a much much bigger boost than going for 2nd. 
get splat2n n say goodbye 2 reality 	I heard that splatoon is not nearly as fun if you don't have friends to play it with?
Part 7 = LaChappa 	I'd say Shelly, actually. Lachappa has 10/10 repair so he has a defined role at least. Shelly, however, has no defined role, much like part 7. Both are considered the worst of their cast as well.
There's been 39 free kicks paid and it's not even half time. What the fuuuck.	36 -18 Cats way. 6 minutes to go 3rd quarter. Rubbish umpiring. 
[My ship, after back to back missions to Hutton's Orbital and then to Weinbaum City in 36 Ophiuchi... ](https://i.imgur.com/MNPdaAx.png)	&lt;3 the dented paint. I would leave it like that.
Wait theres no CPY version 1.4 right? Just the 1.2.1? Can I play the first DLC with the 1.2.1?	Yes, that is possible.
Weekly reminder to not download the SNL app, it’s garbage	There's an actual app?
Are you going to be ringing at the lamp or the church/fog gate?	Church, please
Could you [keep it to the original thread](https://www.reddit.com/r/CasualUK/comments/83icuj/alright_everyone_its_saturday_night_lets_settle/) please as this is just a comment, rather than encouraging a clutter of full posts. Cheers! 	Ok
What do you like to feed to your slaves 24/7	Pizza
# No! Never give up! Never surrender! # To infinity and beyond!	I admire your commitment but sometimes you just have to give up, otherwise you’re disobeying a direct court order.. “To probation and beyyoonnddd!” Lol
idk, i'll be sitting over here with my octotank tho.	If you see a spread named turtle, say hi, lol.
Am I the only one that prefers double exp events over any others?	I’m sure plenty of players under level 40 are in the same boat. That’s interesting that you still prefer them. Is that mostly in hopes of them raising the level cap eventually? 
How does one have 10k followers with 50 average viewers? 	Massan disciple OMEGALUL
I'm... speechless.... Y'know, after that fastfood music comment Salvador made last year, I would LOVE to see him having to hand over his trophy to this.	Give it a rest with the Salvador bashing. No need for it.
"Anyone who says begone thot has never been with a woman IRL."	You are right. I just said it and all my past lays never happened now. We should warn people 
I think it's going to be the Bears and Niners getting Arob &amp; Watkins. The other really WR needy teams can't come close to our cap space, unless an unknown team (Jets if they can't land Cousins?) jumps in. 	I think the Rams have enough capital to re-sign Watkins now after all their moves.
Yes, sounds like it's being recorded on a phone, something with compression. A different device.	It sounded a bit more, idk pitch-shifted
Feels good to be mining again :)	BTW, GTX970 working fine!
I'd rather see Doctor Strange vs Dr. Horrible.	Only if it's also a musical.
Tardus I thought he was trash but made a fantastic wood team with him. 	Whats your team looking like?
Breaking Dawn Part One. I think it's the only twilight movie I've seen from start to finish.	The birth scene is absurd
Why do you have space for the case for a digital copy of PUBG?	It has Forza 7 in the case, just obsessed with PUBG so I like the way it looked.  Makes my OCD feel satisfied. 
I've made installation of cl-notebook simpler by using Qlot and Roswell: https://github.com/inaimathi/cl-notebook/pull/9 Now it is very easy to setup on OSX and Linux.	Nice ! (Qlot and Roswell involve a little but too much manual config for my taste though… (to make it work with Slime. Qi doesn't for example)).
I had to double check to make sure it wasn’t me posting this. 	:((
I was so sure that this was a Subredditsimulator post that I spent 10 seconds looking for the _ss in the subs name.	r/notsubredditsimulator 
everyone I've ever heard about it says it is by far the best DK ever	It's great, but still can't beat out good ole DKC2.
I am know it is more of an unsatisfaction Than a bug	But if it's stopping me from being able to brawl properly, then it really is a bug. It's not that I don't like it; it's stopping me from playing. That's the problem. All they need to do is implement a "fixed" option in the settings.
I love the idea of meal prepping, but I can't seem to make myself do it. The closest I get is pre logging food. What kinds of things do you prep that keep well all week?	I found it easier to start with things whose textures/flavors don't get weird, like soups and chili.  I now do other things like burrito bowls, casseroles, or things that do well reheated in the oven (like enchiladas).
It would be cool if movies were led by the creative direction of 1 or a small group of people who actually wanted to make the movie instead of letting it be driven by test screenings. I mean... who is in these test screenings?	The problem isn't test screenings themselves. It's people in the production not knowing how to use the information you get from test screenings. 
Threat level midnight	If it lasts more than 3 hours, consult your doctor. 
What chestpiece is that you're wearing? It almost looks like the metal cuirass, but I didn't think it was in game yet. 	My character on the left wore all Sovereign clothing
If I attempted this, I would have one of the bulbs I carry in my luggage shatter, and then have to burn my luggage, since it would otherwise be covered in powder and shards for eternity	You just put it back in the original box where you had the other bulb 
Either he's barely in it or he has a pretty important role that they don't wanna spoilt. I'm hoping for the latter.	he did give up his role in mission impossible for this right? so hopefully youre right
Oen method??So you people never heard from nobody before to put your cotton trough the coil as tight as you can???	apparently not
Maybe try World Market	Definitely considered it! but procrastinating on driving to Clackamas or Tigard after the NW location closed. 
Sounds like a threat 	chainsmokers updates and 'is that a threat' comments, name a more iconic duo 
Picture definitely needed	https://imgur.com/a/n8brP Anyone had anything like this happen? Or have any suggestions for me? I'm pretty sure I'm liable for repairs.
Churn less. Dial it back to every 6 months	Yep. Seems like this is the way to go. Also will wait for positive credit reporting to be the norm. 
What type of business is it for if you don't mind me asking?	An outfitter 
Anyone know why they don't allow photography underground?	Some of the tour goes on to State Parks Property. Parks requires written permission for individuals to photograph on these properties. Other property owners prefer that photographs not be made of the underpinnings of their buildings for security reasons. 
I want to play my Nintendo Switch in docked mode. I've been mainly playing it in handheld mode by now. I am going to buy a new TV but I don't know which one to choose that is best for switch. I have a choice between 40inch 42inch and 49inch. Which one will be the best for Switch's picture? I don't want it to look blurry or the picture look stretched out. I want the sharpest contrast and color. Please help me to choose.  	I got a 49 LG UHD and the Swtich looks awesome on it, even games like stardew valley really benefit from the higher pixel count and vibrant colors. Honestly the switch is an amazing piece of tech
Worland is 30 mins from Thermopolis, quite a bit bigger to. Maybe worth a look	Thanks for the tip!
