I think they're coming at Gwinnett Place Mall next week. They've recently installed some older store fronts, Sam Goody for example.	Cool! Any pics you could make and show us?
Yeah seriously, it's insane that no is telepathic	Who's no?
Love the busy wackiness going on in this  collage! Any plans to add some funky coloring?	Thank you! I’m a bit scared to add colouring tbh, I’ll probably mess it up somehow :P
1 pull = iodized salt	Is that better than regular salt?
Love your shop!	I love you both
Isn't "lit Molotov cocktail" redundant?  If it wasn't lit, it'd just be a jar of gas.	I didnt know there are people too stupid to understand how Molotov cocktails work…
Just got out of jail. Is Bwipo the best player internationally?	I love how memes cross subs like this
I don't know I think the ornata is fine, I actually switched from Mechanical to it which is mecha-membrane	It is overpriced, but I just love the way the keys feel.
If we go even with Leverkusen on differential, it goes to head to head correct?	No, goals scored. 
I started my SE army yesterday with the soon old starting box (the one with the khorn guys aswell). Pretty hyped about the new one and i‘m hopping they will synergise well	Same with me, finishing the old starter and immediately getting the new one!
What do you do now?	I'm doing my bachelor in French and want to get a master's degree in International Relations afterwards.
From my point of view The Last Jedi WAS bad. 	Well then you have a different opinion than me and I respect it even if I disagree with it!
How much were your beers 440ml Carling is £4.25 in the coop but the pint cans are on £4.75	Wow! Expensive. Buy a pack of 20 for £12. Tesco or Asda.
Improving for four years but still no luck? Ouch. Sounds like you need to improve your social circle. Easiest way to get a girl is when you have friends. It's becomes natural 	My status is low indeed. I have few friends also due to me having been in monk mode for a long time. That’s probably my problem, I need to meet more people. 
How did the punishment go Sara?	I haven't done any of them yet, during the maid course. They are a part of the punishment system, letting the academy use them whenever they want. 
That dog be thinking ‘you chumps to slow’	Probably thinks he's got a pack, and they're about to roll out.
He’s sitting like a Skyrim Jarl. 	She’s only marrying him for his Vibranium.
First time in Vegas history they have lost a game 1	First time in history the Jets have won the first conference final game. 
I personally dislike him because he is arrogant according to my perspective. He had tweeted https://twitter.com/neiltyson/status/894689139853012992 this once which made me dislike him further. 	Wow..that's a stupid thing for anyone to say, but a really really stupid thing for someone in his position in society to say. He sounds 12
To be fair Kent Island is barely the Eastern Shore	Kent Island is basically the artist brother from the wedding crashers to the rest of the eastern shore family.
We should have a known scams section/sticky.	/u/Jarunik, any chance of making a wiki page of known scams, then linking it in a stickies thread?
Pleeeeeease BUNGIE add Competitive Solo/Rumble Queue!!! PLEASE!!!	  Agreed. Not all solo players are casuals Bungie.
If it fits, I sits! 	U my friend, have earned an upvote.
Vanquish 2 please	Such a great game.
#THE RIGHT TO ARM BEARS SHALL NOT BE INFRINGED	If I could change the title to this I would without hesitation
Punishing jund has a good delver matchup.	Unfortunately it doesn't have a very good everything else matchup :\(
Beauty in chaos. Like you, I too was born and raised in Kathmandu and absolutely love it. People say it's dusty, noisy, polluted, corrupt, but when I walk the streets, I see none of that. I see it as a beautiful mess and absolutely love it. 	I'm surprised you don't notice the pollution and the dust.
Just went for a really long, hard run. It felt great. Still waiting on my overdue period and trying very hard to ignore social media, avoid restaurants, and anything else holiday-related. So far so good. Going to plant some things before acupuncture later today. Good luck to you all today ladies! Remember that tomorrow will be another regular day. 	Ohhh a run sounds great! Good for you. I just stood up to change into exercise clothes. Returned to my seat with a glass of wine instead.🤷🏻‍♀️
In Europe we had the Citreon DS3/DS4/DS5 etc. The DS spun off into its own brand. Abarth used to be a sub-group within Fiat with the cars being called Fiat Abarth Whatever. But now Abarth is a separate (wholly owned by FCA) subsidiary. In the opposite direction. The Audi Quattro used to be a separate car but now its kinda like a trim level	It's funny cause I sometimes hear people call their car an 'Audi Quattro' when it's just something like an A4 TDi Quattro... Likewise they'll say 'I drive a BMW M' when they mean a BMW 320d M-Sport
I don't get Ziggler's appeal. I particularly don't get why people still support him when he's shown no desire to change what isn't working.	An underrated factor in SDL's recent return to form is Ziggler going to Raw.
I doubt they will ever bring back og step ups tbh	How were the og step ups different than the ones now? I always took breaks during step ups so idk about them or how the og ones were better like everyone says. 
This has been me all week too. My mom basically abandoned me as a child and I spent my formative years with a n step-parent. First I thought I saw my dad’s n/ex while grocery shopping the other day and cried in the parking lot. Then, my roommates were watching Matilda. I love that movie, but it hits too close to home. This afternoon I’m working. I’m a tattoo artist and we’ve had so many people coming in for mother/daughter tattoos. I just can’t wait for this day to be over. Now, I’m celebrating Mother’s Day with my MIL. She is such a wonderful mom, but I just get so sad being around such a loving and functional family. 	That Matilda feeling... I know it well. 
Who even has the holy bible on their phones these days?	I do
The Celtics are now 3-0 when I watch with my month old nephew who wears his Celtics bib.	Your nephew is the new Klay toaster.
Too lazy to find out to map out the whole song but from what I can tell after listening to it and messing around on my uke, it’s in the key of F and uses the following chords; F A7 (or just A) Dm Bb C7 (or you can just use C) The opening is somewhat like this (with each chord getting 4 beats): F   A7     Dm   Dm  Bb   A7    Dm    Dm Knowing the chords and the key, I’m sure you could experiment and figure out the rest of the song : ) 	Technical question and slightly off topic perhaps, but how do you figure out something is in the key of F?
How do you loop oceans or, better yet, how do you render oceans from above?	use houdini the hexagon will say
Its on like Ronkey Kong!	Donkey Ronke sounds better!
no. As soon as you go above 1080p it skews a lot towards the GPU, the higher the resolution, the more the load on the gpu and less on CPU. EDIT: you should have no problem with a 1070 at that aspect ratio as long as you don't aim for ultra I guess.	So my 1070 could easily handle 3440x1440p 21:9 or should I stick more to 16:9 1440p? Thanks for the fast reply! 
From left to right. Maisy, Bruce, Bub and Boots in the middle.  	I’m a fan of boots 
Question about the TDEE spreadsheet: Should I be subtracting the calories I burn through exercise or not? I feel like I shouldn't but I then also feel like if I don't, I'm not being honest with the sheet. I don't log everything, mostly just the high calorie burning things like extended cardio. I haven't seen this discussed anywhere so I thought I'd see what the smart ladies (and dudes!) here thought. 	put in your gross calories, not your net.
Ummm I’ll take one 	I could totally use one if /u/binary_burn can save a couple!
I don't see why card check is preferable to the secret ballot from the worker's perspective. It's obviously preferable from the union's perspective.	If unions exist and are capable of affecting change, that's pretty beneficial to the workers.  Like.. yeah keeping a school open *directly* benefits teachers more than parents, but those parents probably don't want to defund their kid's school either.
[Sample](http://i.imgur.com/Y7DxtLY.jpg)	Oh gee. Harder than I thought. 35?
Did the car stop in the middle of the road? Or did it just not start again after you pulled over until you tapped the sensor with the card again? 	I gave my phone to my friend and was able to drive around the block no problem. Even put the car in park and back into drive. I didn't try getting out of the car though, that would have probably locked it.
Hi there. From my experience the living together for 2 years requires a lot of proof. If you don't meet the requirements for it you won't get it. It's 6 or 8 letters addressed to you at the same address spanning 2 years? Also this is a very expensive route to go down. See my post on the other subreddit ukimmigration	Thanks for this. I’ve checked out your post, and you’re right - it’s a tough one. 
Your macros must input something like “Q, M1” then set walls to Q. Add a small delay between Q and M1 as well—like 2 ms. I would suggest AutoHotKey scripts, but I’m sure they ban accounts that have AHK running in the background. We’d need a statement from Epic before using AHK.	Interesting. I'm going to try this tonight! Will let you know if it works. Thanks 
I got to play a number of times with Sonny Simmons, a brilliant alto player. What I observed was the audience thrilled at the chops, loving the dexterity but not connecting to the actual thread like one does from a straight\-ahead solo. Predictability vs. novelty/innovation. To engage a non\-musician listener, there needs to be a thread they can relate to. A player may follow the train of phrases, but even then, prediction level is low, so you tune out after a few minutes. Dixieland \- high prediction, low innovation Avant\-garde low prediction, high innovation And in between is pretty much a timeline of great artists. But the MARKETABILITY and ACCESSIBILITY of free jazz will always be low because we no longer LISTEN to the music, it is mostly background.	Great points, thank you!
**"Players can no longer vote for themselves on the end of match awards screen."** Finally I no longer have to vote myself when I get a previous vote to show that I didn't vote for myself in the first place even though I ended up voting myself anyway.	So I’m not the only person who does this? Good to know. :p
deserved, not sure what he was thinking on that play	I thought he'd get a game for it. 
Alternative plan, why don't we just outfit every animal in the world with combat boots? That way they think we're everywhere.	april fools to it to a new level
My tots journey Akinfenwa &gt; Sule Lopez &gt; Lemar Sule &gt; Mane Lemar &gt; Eriksen Criscito &gt; ter Stegen 	Dude I'm ready to trade 3 tots for Eriksen or even mane. Idk if this happens to me because I'm on pc which has worse pack weight than consoles.
Can you recommend any mounts? I had this concern myself after seeing the size of the Alienware tripod. 	VIVO dual or single, I have 2 singles for future plans... 25-26 bucks for 1 or 30 for dual.. and they are still holding hard.
Holy guacamoli! How did you get a copy of Ace:Clown?!?	You must be Moe the Clown's #1 fan
Founded in 2008 by Victor Oviedo and Anthony Scaramucci, SALT is committed to facilitating balanced discussions and debates on macro-economic trends, geo-political events, investment opportunities and philanthropic efforts. With over 1,800 thought leaders, public policy officials, business professionals, and investors - from over 42 countries and 6 continents - the SALT Conference provides an unmatched opportunity for attendees from around the world to connect with global leaders and network with industry peers.	For the good of who? 
[This takes the cake](https://twitter.com/ReggieWayne_17/status/989623112437305345) Messing up badly once? It happens. Messing up badly three times in the same article? Yikes. Author predicts Peyton Manning and Charles Woodson will be busts, and Ryan Leaf will be amazing.	Do you by chance know the name of the author/columnist who wrote that? I wonder if it was Skip Bayless...
Bench is like “oh yeah, cool we scored lads.”	Righto chaps! 
Have you tried turning it off and on again?	If I could reboot my brain, i would. 
what is the code? 	Strongstyle 
But Yellowstone though...	Yellowstone is fine. That's even worse fear mongering. 
Starting em young, I see	technically they are too old already :D
Do they help people with bigger hands? Just curious. 	I found it the most comfortable for my larger hands.  All controllers thereafter have been too small and never fit as good for me. YMMV
OMG 😲 she’s👉👀 such a good quirky 🙂 girl. She doesn’t drink 🔞🍺 and is definitely not a thot 👩‍❤️‍💋‍👩 👀! They 🤣 exist!!	r/emojipasta
Where Is this? i'm currently playing through the mod myself	I dunno, somewhere on the top of /r/beyondskyrim.
I scored higher on the official one, but that’s just me. The general rule is that your scores have about a standard deviation of three either higher or lower from where your practice tests were. 	I did as well, 27 on practice but 29 on actual
[Any excuse to share](https://imgur.com/a/4zzssYm)! It is my 399th day of Keto today. Sometimes I’m still in disbelief about how.... not diet-y it feels. And some days it’s hard and I struggle. Good and bad, consistency is the key. 	Love it! You even look younger.
Fatsia japonica 	That stuff is the superman of shade shrubs, but his kryptonite is the sun 
I had been waking up at 3am to go to work for so long.. these later wake ups are messing with me... What's for lunch?	https://old.reddit.com/r/MealPrepSunday/comments/8iy2tx/spicy_lamb_meatball_eggplant_and_chickpea_stew/ This! Except I made mine with beef and I'm eating it with pita bread. 
10x returns by year end 2021	more
Pretty nice color choices. I would of copped for the design and especially the story behind them. 	Thanks!
/u/Ficction Hello! When do you want to play our last game of the season? I expect to be available most evens after about 6:30PDT and all weekend. Monday is also a holiday so, you know, something to keep in mind.	Alrighty.   If the div rolls early we could play Wed night.  Or we could just go for Fri or sat
I cannot find this tweet.  Did she delete it?	Everyone should report the tweet for incitement of violence https://twitter.com/anncoulter/status/996011689127694337?s=21 
I fear that this new FFA comp will be full of spamrats...	Play Pharah
Just began the game so still in Z Like the 3D-converted scenes so far	hope you enjoyed it because that new 3D scene is the only new one in this version
The major point buried at the end is that Multnomah County has a higher voter turnout than previous years: &gt; In Multnomah County, with the state's highest voter registration, elections office spokesman Eric Sample said that voter turnout seems to be higher than in previous years. By end of day Monday, 95,276 Multnomah voters had returned their ballots, compared to 84,801 in 2014. So while Multnomah voters are highly-engaged, the rest of the state is sitting things out this go-around.	Washco is also highly engaged. Turnout is mostly suppressed outside of the Portland area.  
this is my latest beat. https://www.youtube.com/watch?v=lTsrxkU9lbY I'd really love to hear what yall think about it. especially what yall think about the mix. returning all feedback as well	the pad and soft pluck sit super nicely in the mix, props, don't have much to say other than that about the mix, seems real nice to me, particularly the width of the snare reverb. The track is good but there's nothing that really grabs me especially about it
but there is 42 dinos	there are thirty total profiles on the website.
Ability to grow a fully connecting beard or pleasant full stubble. He can lift me easily, so strong arms, back, quads. At least 5’10. Fits in clothes nicely. Nice lips, not scaly or chapped; nor overly thin/nonexistent. Great dental hygiene, no visibly rotting teeth or smells of cavities. 	&gt;At least 5’10 What about 5'9.75" 
That's some wired looking hardwood	Just noticed it in the top right still no toes tho xD
A lot of people don't play it constantly, but rather an hour every day on average. I'd definitely say it's catered more to those people, as opposed to other gachas which require you to be constantly on them. If you play a lot, you can try playing other gachas/mobile games at the same time. Also nice Atk Ploy	-res Ares cries in fear
This doesn't look like one of our favorite Christian boys	r/madlads
The search is essentially useless 	Search is essentially useless in all Apple apps.
They also don't keep the +3/+3 from dire frenzy	that seems normal behavior to me
Maybe seeing the problem would help. But this also isn't really an R problem, more like a stats problem, so /r/homeworkhelp. 	I guess you're right. Just confused because I am trying to learn doing things like this in R, but I don't really understand statistics or R enough yet to look for the problem myself.
LLAMASAUR is coming! 	Godzillama
If I remember the old lore correctly it's so that Yi can see across a greater spectrum than normal human vision allows. So I guess he can see ultraviolet, infrared, and whatever my team is looking at after I dive in to initiate for them.	&gt;whatever my team is looking at after I dive in to initiate for them I know your pain.
I'm surprised nobody suggested sending out a rescue team for the Sorcerer King.	Maybe Ainz will show up at the worse moment conveniently saving them 
Any update on a challenge?	sic_temper is filing a challenge today. Hopefully he will give us an update of how it went. There may be other challenges also. 
Hey guys, could you rec me some really warm/comforting indie rock music? I'm about to go on vacation and as fun as that is travel stresses me out	Duster - Stratosphere The Mountain Goats - All Hail West Texas
Buy the dip! Easier said than done! We are going to 30$ when mainnet launches!🚀	YES!
AB, Gronk, Von Miller probably	What's AB done that makes him a lock? Edit: downvoted for asking a question. Nice. 
Hey, I really enjoyed your podcast in the past. Are you planning on doing them more frequently?	yes I'm working on getting it back underway, just been real busy at a new job. by end of month a weekly show should resume. thanks for listening btw.
Depends on how relevant the anecdote is to the essay	Honestly I wrote about trying new food and being exposed to new surroundings in school (new classes, new subjects)
This would be my first ww2 game since cod2	Wow, mine is WaW which I assume is same for many.
I'm a little confused - by ACG do you mean Advanced Class Guide? How did you play that without actually playing the Pathfinder RPG? In any case, congratulations on a great session &amp; welcome to the community!	Oh, my apologies! I meant Adventure Card Game~
Reylo lol	That seems to be an unusual opinion for this sub. What was it about the Reylo aspect that you liked?
it's around 20, but possibly a few more	ty
Daily thread questions! 1. Best topping for crumpets? 2. Socks on or off in bed?	1. butter &amp; vegemite 2. sock free zone 😬😬😬
Can you tell me whats the number of pre-mined coins that etn have? 	Around 7 billion I believe.
Ow ow ow ow Ow ow ow ow In the U.S. I've used a product called mole skin. Works best as long as you use it before there's too much irritation. But definitely helps. Your heels were hurt to bad for it tho. Hope you get better soon. And see a doctor, don't let it get infected. Good luck Edit: sorry I didn't read more posts or I would have seen this happened last year. Ah well, have a nice day.	My parents are doctors and they told be to walk it off 
I’m guessing the S because saying cent and scent is the same 	But saying Sent and Scent is the same also.
Cut them in half then put a mix of mayo and mustard at a 10:1 ratio then top with salt, pepper, and paprika and they are good	Throw in some tuna too.
Debating whether to get some APH or TNC.  Which do you like better?  I haven't checked it out yet, but I hear APH has got a really nice wallet.  Also, from what I understand APH is like a P2P DEX is that similar to Switcheo?  	Yes but with aph you will share in trading fees which are distributed relative to the size of your holding which is awesome
You aren't alone in feeling post\-MCAT burnout. I would recommend stepping away from your books, spending time with family and friends, and returning to the hobbies you most likely forsook while MCAT prepping. I definitely fell into a post\-MCAT funk, and these three things really helped me regain my sanity and physical well\-being. Know that this is temporary and you will feel better soon 😊 👍	Thank you! Yeah I think I just need to put things back into perspective again. I'm glad to know I'm not the only one feeling this way after the MCAT :)
I could listen to you all day!	Aweee
Literally the worst CUV on the market the years it was offered. 	Especially since it wasn’t a CUV, but a RWD/4WD SUV (albeit unibody). Worst CUV probably goes to the Jeep Compass/Patriot.
&gt;That's exactly what they did to their previous competitors in other areas. which are?	Exactly!
Did anybody else read this in the article:   Trumps first stop on his first full day in office was to the CIA headquarters in Langley, VA. Literally. The first thing he does is march into the DeepStates HQ and tells them "this is how it is now."	And he said something about taking columns down
Looking for an all mountain board which should be better at freeride than freestyle. It should also be a bit playful and quite nimble as I want to take it inbetween trees etc. And id like to be able to take it easy and be lazy at times :) What do people recommend? Id like either RCR or CRC boards :)	Your best bet is to demo a few that you like. My favorite board right now that I take out whenever I'm just riding without a plan is my Rome Gangplank its a 15/16 but I love that thing
&gt; Wow, that's stone cold there, Kylo. Heh. I really like how your Kylo Ren has so much more focus than the movie version; it's a really intriguing take, and I would have loved to see how your version had played out once BB-8 figured out what's really going on. That is one fierce little droid, after all. ;)	Tweaking characters is an author's prerogative... ;-)
So you didn't get a chicken then	No chicken this game. :(
Maybe we’ll get a HL3 VR release one day! *crosses fingers* But seriously, even a TF2 VR version would be amazing! 	Tf2 is already playable in vr! It is hard to play though
[Err, you still can for reloads.](https://www.youtube.com/watch?v=ZBSjdG7WG5I) It's a little trickier I admit but still there. 	how does this work? I used to do exactly that before the beta update, it doesn't seem to work anymore.
I just downloaded the source and started to polish some UI stuff and optimize performance in some parts.  Hope you don't mind random PR's :p.  I've been doing winforms dev full-time for 6 years now and need some more WPF exp, hardly touched it.  I was going to make my own program like this about a year ago but I don't have the free time to head a project myself.	Hi, regarding the UI I'll be rewriting a lot of stuff for [4.5](https://github.com/JosefNemec/Playnite/projects/8), but if you plan to do just small changes then feel free to commit PRs. For bigger stuff I would recommend getting in touch via Discord first so we can coordinate.
I'm working full time over the summer and am trying to find things to do with my days off in addition to the gym. Other than fishing and gardening, what fun things do you guys like to do outside? Currently the majority of my time is spent inside playing video games on my days off but the weather is too nice to ignore and I feel like I need to do something productive.	Go rock climbing for forearm gains
Don't buy it OR a Macbook unless your hobby is wasting money on useless garbage.	true
Finding products that work is such an incredible experience. I adore the biossance oil. It feels so luxurious and works so well. However.  you’re ever looking to pare down the price point, I’ve found that mixing TO’s rosehip and squalane oils produce pretty much the same result, and found a great vitamin C treatment to use separately. 	Ooh thanks for the tip! A broke girl living in NYC has gotta save lol. 
Girls, in a nutshell. Reminds me of the "I'm here if you need to talk" skit on Rick and Morty.	Love Rick and Morty! Just starting to get into it!
“Sometimes guys just pop up”	Hahaha I could see this happening 
Dusty’s feathers. I’m still recovering from that one. 	Same. I still can't process it.
I need help identifying the match this [clip](https://www.youtube.com/watch?v=c0BAOtEKlho) is from as well.	i’ll be about 20-18 minutes 
He looked back at the owner like "if it wasnt for you"	????
As long as I'm allowed to have more.	Maybe ;) 
To be fair, they cancelled the show so why would they promote it? That said they have hardly ever promoted it and are to blame for that.	&gt;y would they promote it Because it's still currently on the air
How did Diaz leave the car w/o making a sound?!	Ducked down onto the floor
Wow! Yes! Thank you. Must have been a lovely day to walk around barefoot in the grass!	It was great!
So umm with the ending is Vanessa alive? 	Why didn't he save the other three?
Wow, as melon scratchers go, that's a honey doodle.	Could you impersonate Chief Wiggum for me? 
I pace nonstop when I'm on the phone	I do this too
This one pops really nicely 	Agreed, especially the wires and you can see the depth of length of the carriage. Heck, the reflections off of the windows are cool.
