Grow a beard.  It's our birthright as men.	Yawn
I have a sudden desire to jump through a flaming table and I'm not sure why	LeSean McAllTheWayToMpls
Yes. Give your QB the best running prospect in years, and the best player in the draft. Minkah is fine, but Barkley is as elite as they come, and a can't miss prospect this team desperately needs	I'd say their talent levels are very similar at their respective positions, but usually when it's close between a running back and a FS you take the guy who's almost certainly going to have a longer career in Minkah
There is a NYRR Midnight Run that starts at midnight in Central Park, so there should be some music things and definitely fireworks, it is a fun atmosphere and not a crowded mess like Times Sqaure. If you can brave the cold then have at it!	Good to know, thanks! We've been braving the colds for the last few days so one more night should be do-able.
I'm drinking a Brut Rose of some sort after having chased my husband's friends for the majority of the day.  He's asleep in his chair next to me and considering that we've been contemplating splitting, I'll take it. He threatened me with divorce and the next day I made a list of how we would separate assets, etc and it shocked his system that I would take him seriously.  I'm fairly lubricated and probably not making a ton of sense but the short of it is. . . we will make it.  It's been 20 years, we're both fighters, and well. . .Happy 2018!  New Year, New outlook!	Good luck! I really wish you all the best. Marriage is hard, man. But worth it. 
Glossy neck?	Yea :/ Tempted to sand it down a bit, but it's not the worst.
Why does he need a wildcard? Isn't he ranked in the top 20?	No, he dropped all the way down to 46 in the world... It's ridiculous how he started 2017 in top 10 and finished the year 40 places below. 
We're here in 2018 while OP is over in 14471.	I didn't know Earth had that many time zones. 
Social democracy is the left wing of fascism.	Lol this is one of the most hilarious tankie soundbites, utterly baffling. 
Love this show 	I have been watching this show religiously since it came out. I fall asleep to it just about every night.
Any breweries open today?	Yeah I have the same question. Wonder when New Realm actually opens. 
Go to the site: https://www.youtube.com/channel/UC_D2dx6gG2mYKuSAqtkMFqg is TRNSPRTR or Ttransporter one of the 200 Galactick BRR he runs this season 12 on a 918 Maxed and learns ...	Where do you find the reruns ? Do I have to own the car to rerun ? Thanks :)
How do you record the screen on the watch?	I'd say it's a screen recording from the phone... :-)
I have this feeling that this is not gonna go well for SRK.😂	Ahhh, I really hope you're wrong! We need more original ideas like this, FAN, etc. in Bollywood!
I am working on the Stark one right now! The patterns are from Etsy. Was supposed to be a Christmas present for my husband. Your Gf obviously has better time management skills than me! 	I too greatly underestimated the duration of time it would take to complete a 10" x 10" needlepoint Chewbacca pillow for my brother's Christmas gift. As of Sunday, I think I'm halfway done. Best of luck to you!
Did you guys see Maddox's salty-ass video about Arby's marketing taking advantage of gamers or whatever? No fun allowed	Yeah, using humor to entice people to your business for a largely arbitrary decision is the worst kind of exploitation.
Thinking of setting up a NAS soon. Should I grab this or should I get an HDD designed for that purpose, like an Ironwolf or WD Red?	Depends on how often you are writing to the disk and how important your data is.
Thank you so much!! I’m totally going to use this if thats cool with you. 	Go ahead my dude
How did you clean the tar off?	Used an old wood planer, and going 1/32 at a time we took layers of wood &amp; tar off.  Repeated the process 4 or 5 times to get most of the tar off.
I'm using Open Build Service in order to maintain the transparency, building from source directly. Feel free to test it: https://github.com/xmrig/xmrig/issues/309 Note: Please provide the feedback on the GitHub issue. Thanks.	Is the vm killing the hashrate? Seems low for an i7.
Wait .What are the ones left of holly?	Emerald and Hessonite
I'm not sure I want the glaciers back.  I've never been the nomadic type walking around in furs. 	just come to the midwest right now for a sneak peek
If she has otherwise been a good employee cut her hours per her request and demote her.  If things don't work out, then terminate her.  Don't terminate employment based on what you think might possibly under the right conditions happen, terminate based on real actions.	This x1000. Don't cause problems where there are none yet.
Just 6 points halfway through the quarter? Where have I heard that before?	Hey that's like three times as many as the Toronto game!
Electrum Sabercraft has a lightsaber that connects to your phone via Bluetooth! You should check them out.	I chatted with them a minute and they recommended a DIY Arduino project. I think gutting an echo dot and a custom board could work though.
You consider letting a set come to complete silence &gt;5 times putting 2000% into each transition....?	Those are some of my favorite parts. When the sound slowly fades and it's replaced with people cheering. 
Just looking at Violets heels make my feet hurt 	They're Louboutins, the pain is worth it.
I’m a personal trainer.... boardgaming came naturally since when I was 10 I had a Spectrum and videogames grown with me till today ;)	Favorite game from it??
that's actually somewhat realistic, besides that she's talking to herself 	I did try a playthrough where I named all my pawns "Dave Dave" for fore and surnames. It got very confusing very quickly.
at least 3. Maybe even 4 	We have a winner
Read up on Mustique. It would be a serious coup. But I suspect totally outside the realm of what the folks at freesociety.org are targeting. This is the playground of those who call themselves royalty.	what do you mean serious coup?
lolololloooolllolololol. Please, though, seriously Bandai. No more OP BRV units. Give Madara to BOD / SKL / WIS please.	WIS is pretty lacking in good healers in my experience. There's Karin but I don't even know who else. 
Druids have a spell that lets them create a woodland haven for 24 hrs. It’s 5th lvl. If it is casted every day for a year it becomes permanent. Maybe consider doing the same. If he casts it once a day for a year it becomes permanent 	That's generally how spells that v an become permanent work in 5e, so I'd agree with this idea. Conversely, the ship could be created as a magic item (probably Very Rare or Legendary), with appropriate time and money costs.
If they're not clear that they're a prozzie then you don't have to pay.  This story sounds like a normal human interaction except for her saying yes.	You can report them to the Better Business Bureau for misadvertisement.
timbre is a good app that covers many	awesome I'll check it out.
It was a game that happened.	It wasn't the worst game we've seen from Spurs 
Those look fantastic, enjoy your games!	Thanks! I can't wait. Played a small 100pt game a few weeks back with a borrowed army. That was enough to get me hooked.
There's also an app in the store called interference that does the same thing as drawception. 	True, but I've spent a long time playing Drawception and have made friends there during my time so I don't think I'll be switching anytime soon
Don't thread on me	Tread softly because you tread on my dreams🤤
Does DeRon really not practice hard or is Dakich just a colossal fuckbag?	The second one
So all it takes is multiple level 99 magicites, legend dives, and multiple rank 5 abilities honed? OK! 	AND multiple copies of 7-8* +element gear of all types.  That's a crucial part of it to get tenable damage, and I doubt too many of us are ever going to be able to run a gear setup like [this](https://cdn.discordapp.com/attachments/251340072262041600/397912741106548736/Screenshot_2018-01-03-11-42-59.png) to do it.
This is unrelated but do you still have Max Payne 3 for trade?	Nah man, I traded it 3 years ago.
Anyway, like I was sayin', shrimp is the fruit of the sea. You can barbecue it, boil it, broil it, bake it, saute it. There's uh, shrimp-kabobs, shrimp creole, shrimp gumbo. Pan fried, deep fried, stir-fried. There's pineapple shrimp, lemon shrimp, coconut shrimp, pepper shrimp, shrimp soup, shrimp stew, shrimp salad, shrimp and potatoes, shrimp burger, shrimp sandwich. That- that's about it.	Shouldn't that be shrimep?
Abolishing welfare should be enough.	Abolish welfare, implement the basic income. Problem solved. Or just replace food stamps with money.
I would say to wait until we know more about this story, this is in a book, which means this was based on information from months ago, and it is not the first time people on the left try to divide the republicans via this way.	There's already some suspected inconsistencies in Bannon's time line, which the book relies heavily on.  It's hard to tell for sure since the people speculating are only going off second hand accounts about what's in it.   It's a wait and see.  
Considering 33% of land on earth is a desert... this is a very misleading headline. 	I think that's different. One thing is a "quarter of planet" and another is "land on earth". Just a remind: about 71 percent of the Earth's surface is water-covered.
I have absolutely nothing to lose in this. This is the best trade deal in the history of trade deals.	Obviously, because all the others were trade deals.
I don't have CoS on roll20, but I do have SKT. All of the maps are the player's maps with all traps, secret passages, area numbers, etc. marked out using the GM layer.	Thanks for this. It stands to reason that Curse of Strahd would follow suit.
In before the right claims she's destroying evidence	Oh, that’s good...will it be in tweet form though?
In two days, I already made the same money I made in 2017. Should I just stop?	I made back all of my losses the past two months the past two days. Let's keep doing this.
JP Donaldson bugs me. Uncanny valley stuff there.	The both look the same to me, which doesn't sit right.
DDR3 is no longer being produced. What you see is the dwindling stock and accompanying prices.	Is there any indication when the RAM prices will come down? I am thinking of upgrading later this year but if prices remain insane I might hold off.
As far as Lore is concerned, the Infinite Forest should open the door to explore pretty much any timeframe or encounter inside the simulation.  Hopefully it can be utilized for some fun surprises in the future or past.	&gt; fun surprises in the future or past Yeah, I was just thinking "imagine going to the tower in the past and meeting banshee-21 with a totally different personality".  In the exos, we could meet them with different way and means they are pre-reset. 
Done. Good luck 	Thank you!
Natsyuri? I can get use to this...	Just posted part 2, which should let you get a better feel for it 
You look lovely	I like your name. 
How did Jah do?	He played.
Wow, I actually have had 3 titans all this time and never noticed that. Still, I struggle with what chest piece to use, the only good exotics on titans are their chest pieces, and the only cool looking chest pieces are not exotics. Probably not worth messing with it, since it doesn't increase recovery, which is the only thing that matters.	Skullfort and Synthoceps aren't good?
Home Sense/Winners + RecRoom	I believe they mentioned the same info on CTV news yesterday.
Between FFT Banner and OK banner, which is a safer (and maybe better) banner to pull on? I'm low on mythril and in dire need of a Hastega+Boostga relic and both possess them. I have no dupes on OK banner but have 3 dupes on FFT Banner (Ramza LMR and Marche BSB/LMR).  I also want to know about the other relics on the banner to know which weighs better.  	Do you have a link for those? The upcoming banner resource on the side is a bit out of date, but I'd be glad to read through the selections and give my thoughts.
Bought in at 1 cent. Keep holding people this is just the beginning	Where can you buy them?
I called mine Sanic	It seems you and about 30 other people in this thread. So good job on originality. 
Here is my hard mode entry, with Bill's new favorite docking method (not really) ! https://imgur.com/a/JTeBh I'm still quite a beginner, but I wanted to at least try this challenge, and to my surprise, I didn't fail ! It was my second mission to Duna since I play KSP, and my first manned one. I only did my first landing on the Mun a few days ago, but it's amazing how much we can do by just knowing how to dock and land things, and how fast we can achieve bigger things once we understand how the game works ! 	Good job! 
Why you gotta call out /u/xAIRGUITARISTx like that?	No clue who that is.   If it’s Red Reign; I fully expect a ban 
I for one liked this show. (Skylanders academy)	Can you provide context on what's happening? Beyond the obvious of course.
Pretty sure, you are as official as it gets.  Thx for all your hard work, love reading the write ups!	$10 and I give u link to real draft sheet
My favorite is when they think I'm going to be ashamed of my post history or that it somehow has anything to do with the context of whatever conversation is currently happening.	Indeed, they are that pitiful. 
The boyfriend of the year award goes to...	'/u/nintendoswitch2017' - Rachel, if she knew my username :(
That dude must be ripped carrying that around all day.	...and the batteries which I hope he disposed of, in a green and conscientious manner, at the nearest convenient recycling centre.
Well boys - I'm taking profits today. Redistributing half of my stack into ETH, ICX, and AION and selling the rest for fiat. I'd say I'm going to try not to come back for a few months, but well.. see you tomorrow (as a hodler).	see you in 15 minutes.
Does anyone have any  book recommendations (runnning related of course) for me, don't mind what it's  about!	Born to Run - Christopher McDougall I found it to be pretty interesting, worth a read. 
&gt;**Space Cannon Offense** &gt;^66.4 This ability can be used even if no ships were moved during the “Move Ships” step. 	Thanks very much not sure how a missed that had to a have re-read that section 5 times
Wow we are not even tryna find a replacement? Surely that means that they're confident in convincing him to stay	Lallana is fit again, like a new signing .
In Evolution merchants will carry the (low low) fees for acceping a payment. Why? Because they are the one's who want to get paid. P2P transfers are planned to be completely free even. One problem I'm curious to see an answer for is how to enforce InstantSend from the merchant-side.	Don't forget, Merchants will no longer have to suffer from, (unfair) cashbacks.
Many years ago, we joked that the remodeling of our ER would include an entryway in the form of a CT scanner. Basically, every patient coming in to the ER would have to do so by passing thru the scanner. So it's not a new thing ... as a neurologist, I find this somewhat frustrating and inelegant. But so many things are ... sigh ... 	ABCs of emergency medicine: Analgesia Bloods CT scan Disposition Enjoy time off
Do any other devices disconnect from your router's wifi when using the same channel? If you got 2.4 GHz and 5 GHz under the same SSID and if you have a slim/pro and which are not in the same room as the router it could be picking up the 5 GHz signal. If you don't have the Pro or Slim then this would not be the issue. Try unplugging the router for 30 seconds and power it up again.	&gt; All other devices are working fine. I have an original model PS4 about 2 years old 
I cried 4 times when i watched it, i dunno why it wasn't really that sad, i just felt really touched by it	&gt; I cried 4 times when i watched it You gotta pump those numbers up. Those are rookie numbers 
you mean the iron hands EDIT: that awkward moment when you immediately think of iron hands and in your hubris dont check the likely fact that everyone said that and still think your clever af	Its the iron hands
I've always been slightly jealous of people with parents who enjoy video games.	The fondest memories I have of my late dad are me and him online gaming together. Use to play legend of Mir back in the early 2000’s then went into WoW together. 
Was the question specifically about food?	yes, food and drink items only
High. You are very high. 	High on adrenaline 
Hey you dropped something. What? Your standards hi I’m Ash!	Perfect 
😂😂 longest trap attempt ever 	it took so long!
But Sarah Sanders said no one would be interested in that trash. And Sarah Sanders NEVER lies and is NEVER wrong. 	Yes and she wants you to look her in the eyes, if you can.
Can we maybe think about stopping all the Barco tweets until something official is announced?	Yeah there are so many conflicting reports that it seems we can only rely on official news from the clubs now
What about Stellars own decentralized exchange? 	URL?
Yes this was all in their proposed  heterogeneous processor design. Zen CPU + Vega GPU + HBM with a unified memory controller 	Wow, I didn't know that.  Thanks!
Robocop vs Terminator	Well Robocop does take over the streets like a Farmer's Market.
Really?  Steele?  The guy that helped the [US prosecute FIFA officials](https://www.washingtonpost.com/news/early-lead/wp/2017/01/13/the-british-spy-behind-the-trump-dossier-helped-the-fbi-bust-fifa/?utm_term=.23965ffd4b9e) and helped the Brits solve [Litvinenko's murder](https://www.theguardian.com/us-news/2017/jan/12/intelligence-sources-vouch-credibility-donald-trump-russia-dossier-author)?  That guy, you want to charge?	You mean a foreign actor involving themselves in our election and candidate?  Hmm, seems to me if this were reversed you would be up in arms. 
[Just leaving this here](https://i.imgur.com/q48bJ.gif)	Smart move, he doesn't want to get #metoo'd
Bioshock or Bioshock Infinite 	The problem you run into: a movie would only be worth it if the story was taken exactly from the game, yet a movie wouldnt be worth making if it were exactly like the game
He’ll keep him around, I mean, someone needs to be thrown under the bus.	Nah, Kizer has already been fused into the road from being thrown under the bus by Hue so often. Why else would we supposedly draft a quarterback with the first pick? Hue’s “quarterback whisperer” reputation demands sacrifice to be kept amongst the media! 
https://i.imgur.com/cdOi72D.jpg	THE LEGEND HAS RETURNED And I was here to witness it!
are you using alphanumerical chars ONLY for user and password?	i am using only alphanumerical chars but still it doesnt work i changed it like every tutorial says but cant make this thing works...
Lisa Simpson.	The minimum age is 35 and she was eight years old when the show started in 1989, so she's eligible. 
he ran in 2000: https://en.wikipedia.org/wiki/Donald_Trump_presidential_campaign,_2000	Didn't he try in the 80s as well
Not really :/  maybe like 5-6:1 pcc	ach well glad I was busy then.  Lol.
I have a big photo recap/breakdown of my Sobo thru hike from this summer coming! I'll make sure to post here for sure.	Awesome, looking forward to it! I would ask you about the hike but I'll save that for when you post the pictures.
Love the horror vibes here really been needing cthulu and cftbl 	I'll be getting every horror pop I can get my hands on!
At this time in the market, my portfolio has reached some ridiculous all time highs. I’ve been in since May and I plan on staying for the long term with several good quality projects. Does anyone have tips on handling when you reach insanely new all time highs? I’m holding more than I could have ever imagined, and it scares me because I know corrections are definitely a part of the process.	Just don't look at it or treat it as fake. Helps me not take it too close to heart. If you survived other dips, you should be good
The faster I'm driving the more attention I'm paying. Tbh if I'm stuck going to the speed limit or under my eyes will wander. Its just mind numbing 	Seriously, I drive at least 500 miles a week, and sometimes I sit in the right lane at the speed limit on cruise and I invariably almost fall asleep about an hour into my trip. It's genuinely dangerous. 
My grandpas workshop was called "Close Enough Woodworking". Love that kind of humor. 	a saying that has helped me through some tough times: "Don't let perfection get in the way of good enough." haha
TBH, I hope they delete this too to tilt you more.	As you wish.
I don't know if I'm in the minority here yet or not, but I really enjoy all of Yoko's songs on *Double Fantasy*. But that's really all the music of hers I know right now.	Everything except Kiss Kiss Kiss was good on that album.
Awesome! What are you going to do with it? 	I'll probably wear it on my school blazer
Oh he's one of those guys that thinks that "scientific theory" is the same as "hypothesis". Here's the example I love to use in situations like that: "Can you believe they teach the Heliocentric *Theory* in schools like it's fact?!  I can't believe people actually *believe* that the *Earth revolves around the sun!*" Lol.	Orbits around the sun, not revolves
Wyd happened to Foirniers hair? Literally had a full head of hair last year, iirc.	Nah he's been thinning pretty bad for a few years
The individual is the fundamental building block of libertarianism.  The family is the fundamental building block of conservatism.  The state is the fundamental building block of just about everything else.	&gt;The individual is the fundamental building block of libertarianism.  The family is the fundamental building block of conservatism.  The state is the fundamental building block of just about everything else. Accurately describes the failure points of each society as well.
The text is amazing, but everything seems too... out of place. Its so simple, and it looks like a simple design gone wrong. Try to have the pics of the characters to have a similar design to each other. Also try to give more life into the banner. It seems to be very dull and boring. Just some feedback!	thanks for the ideea, I will try to make the next banners less simple and boring
Bi/pansexual people! There's also an orientation called skoliosexual which is people who prefer enbys, they do exist.	I learned a thing today and my mind is blown. Thank you, from an afab pan in a similar situation. 
Ragg socks! https://www.google.com/search?q="ragg+socks"&amp;tbm=isch	Judging from everything I’ve seen that I’ve looked up, LL Bean are the only way to go for these, right?
What exactly is the question? And what’s the “beauty” you’re referring to in your title?	Sorry for the inaccuracy, "beauty" refers to guitar as an instrument itself. May be a stereotype, but I heard that one should learn it using an acoustic one, that's why I asked if it is possible to learn using an electric.
“Secure software” just hasn’t had its vulnerabilities found or disclosed yet. 	I mean isn't that a given? Not that I am versed in IT but if it's made by humans, that means it can be broken through by humans.
its all part of the process of spreading the coins around...you can get back in whenever you choose	I bought it at 0.003 cents so made a pretty profit, but still. dont really want to buy in now.
If you already have the solution at 30mg to 30ml, I think just add 9ml to every mg to get 300ml to 30mg. Or just do a 10ml to 1mg solution.	So if i add 9ml to 1mg, It will definitely be 100ug? I wanna be sure. Thank you for the advice 
I like the little wave in the dove tail. Gives it character.	&gt; Gives it character My favorite excuse when I make mistakes :) Though I think OP did this on purpose
you could run a hybrid. basically you look for speed and zone in a 4-3 backer and blockshed and pwm/fnm is 3-4 backer. Justin Houston is a 3-4 backer while Atwater would be better in a 4-3. 	ahhh gotcha, thanks for your help
Doubt you recognize my name from r/opiates but you’re awesome Tracey and I love reading your blog postings! You’re an inspiration to me and many others. Congrats on 20 years, quite the accomplishment. 	thank you!!
Anime Bethesda mods are a way of life	He noes de wey
27-28 keys	+ Thanks! Bought it at around that price
head on face pictures would be nice. regardless 7+.	Thanks! I didn't post head on pictures cuz I wanted some opinions about my nose, but here are some head-on pics. :) https://imgur.com/a/ctPNL
Why do they call him shady 	He likes to lay in the shade
I will pobably bother to set my kotkeys, download wk and play on voobly once I reach like 2k on hd	2k on hd is about 1700 on voobly.  It’s a shock for some players when they move over.  
Perhaps I misunderstood you, but just so you know, you did hit the damage cap with two of your cards. Well done!	Thanks! I was kinda thinking that I might’ve but I wasn’t 100% sure so thanks for letting me know.
*The* Fleetwood Mac? It's just Fleetwood Mac. And while we're at it, it's just Eagles, not *The* Eagles.	Oh sorry just noticed, I can’t edit it now right? Sorry it’s just i like putting “the” behind the band name without realising.
A lot of the aspects of programming. Did I mention I have a programming job? I feel like my life right now is that old "I have no idea what I'm doing" meme.	I get you. I've been programming almost three years (complete career change) and I'm pretty comfortable doing my job. But. When I go to meeting and other people talk about what they're doing... I'm glad nobody ever asks me questions in meetings.
I would ask about your status so I would know. You should also know and figure out if she is worth your while. Is she messing with you? Or does she truly love you?	What do you mean by "living a lie"?
Gwent	i see what you did there...
