There was an ice golem Nita skin idea before. It made Nita and her bear blue and that's all. You it's the same but more detailed and realistic and looks like something in the game. 	 it's the details that make the difference 
Good build but i would get another 8gb ram and eelace the motherboard with a z370 one for overclocking. Oh and get a cooler	You want him to get 24gb? That's pretty weird
And 6 command dials instead of 3, and 2 spare cardboard base plates, is this just so one can convert another pre-owned ISD to chimaera?	Correct. Idea was to allow you to convert 2 other ISDs to the new forms as well. Extra dials are for Thrawn's command card.
I love it. If I could give some critiques, it would be that there seems to be light reflecting on the lips and leaves but not in the eyes, where it’s the most common to see a “sparkle”. I suggest using the dodge tool or the eraser tool on a low opacity. This way it won’t be too harsh because the rest of the portrait is soft. Well done !	Thank you very much! I always have trouble deciding where to place the highlights sometimes specially if I'm not sure where the light source is coming from. I will definitely take this into consideration with my next painting. :)
If someone’s shoes are worn out, it could also mean that they run/walk a lot, which would usually mean they’re the opposite of fat.	I'm a server so I walk around all day. then someone said, yo why you walking funny? Then I realized the foam at the bottom of my shoes was caving inwards because apparently i pronate
You should contact support, this may be a leak they need to report to EU privacy authorities and the affected users if they did mess up and sent people other people's addresses.	Yeah, trying to. It's harder than it I thought it would be!
A win is a win, and a 6-0 win is pretty pleasing Apparently McGeouch was really good, and so was Maguire	Gooch also looked very sharp, will be a big player for us this year
The game is good too but I feel the UI isn't as snappy and responsive than Hearthstone's.	I just wish there was a way to tell if it is my turn or my opponent's turn.
I'm sad this is no longer cannon	D:
typically the more brown people come to a country the poorer it gets.  i think it has to do with brown people being genetically predisposed to mediocrity.  	Lower IQ
I'll say it again: WHERE IS PROXIMA MIDNIGHT	She doesn't deserve to stand with Marvel's finest. 
Wait Ewiz and mega minion were broken in their release. I didn't remember that	but i remember
Matt and Ryan briefly explain that movie to Arin in one of the Runescape episodes. "Bhorses"	Ohhh I’ll give that try! 
What game is that?	Richie’s Plank Experience 
I replied above and I wanted to make sure you saw it. I just realized that I replied to the other helpful chap and not you. If you have any other WD questions, let me know. 	Will do! 
I think he casts overwatch now. 	Close, he hosts the desk of analysts for the Overwatch League. Mr. X. casts though and is widely considered as a part of the best casting duo.
done	Thank you
I never read that book, how is it?	I love these books but they are kinda rare 
So many assumptions here, all wrong. Where to start?	Yeah, like I could get a date smh
Politics aside, seriously, is this a fashion problem or a health problem	Health problem but she also has poor taste in fashion, it's well documented
I successfully stole my classmate's prized toy cars when I was in kindergarden because they looked pretty cool. I snatched the cars away when he wasn't looking and hid it in my bag's deepest pocket. When he eventually realized that his cars were missing, he checked everywhere and asked everyone to find it, I participated in that search. I also lied in front of his and the teacher's face that I hadn't seen it.  He couldn't find it and eventually after school I saw his parents comforting him and saying he can just buy other ones. At first, it was pretty exciting but seeing him after school with his parents made me feel like an absolute POS (and I still do). What's worse is that I didn't find them that fun and eventually threw them away. 	did you ever tell him? 
Everquest on a tlp server	On Agnarr here.  Not many newbies on but had a great full group last night, got me from 10 to 16 in a few hours in Paludal Cavern.
It was nice, but you lost me at "Gods and Goddess".  Your website [http://www.eleganttools.info/shop/product-category/money-spell/](http://www.eleganttools.info/shop/product-category/money-spell/) also looks like it dabbles in witchcraft-related items and spells.  I can't get along with that.	I knew something felt off about this. All the comments are nice and welcoming(which is awesome btw), but I kept looking for someone to say "hmm, this has a weird vibe".
I sat directly behind Momoa's kids in Hall H yesterday for his Aquaman panel. They seemed so genuinely excited to see their dad on stage and to see the trailer. It was so incredibly adorable.	Pratt and Ruffalo can’t relate
How does that ring give pleasure? Sorry am not familiar with it. 	I think it goes around “it” and makes it hard. 
To address this bias I have valiantly [approved everything.](https://cdn.discordapp.com/attachments/285281772810403840/470652914168233984/unknown.png)	I'm proud of you for showing that even the most entrenched demagogues can turn things around and be good people again. Thank you for doing better. Thank you for being better.
That is poorly worded	Yes would've flown much better if it was worded differently 
You want some money? 	I could use about tree fiddy 
I'm level 105 and I still haven't even touched the Powers tree... I'm a long ways off from unlocking all my monkey knowledge.	Same here. I was more talkative by about tower upgrades
lol why cant we just have an igm philosopher's poll to solve philosophy for good like they did economics	Political scientist poll would also be neat
Misspelled Snips	In the name of the Galactic Senate of the Republic, you're under arrest
The Sacred Grove is an amazing place.  I felt so much peace there.  It's almost like a temple.	I have never gone. For some reason no one will tell me where it is :(
He gets some major development in the Buu saga. I didn't like Vegeta too much from the saiyan- cell arcs, but he becomes more likeable from the Buu saga onwards. He still takes major L's, but I would argue he becomes more useful overall in Super. .	He becomes a fully fledged deuteragonist in Super,
When's Dante's Inferno but with Kratos	You mean that segment of every GoW game where Kratos falls into and climbs out of Hades?
I'm in my mid-20s, but I've been having symptoms at least since when I was 17.  It's definitely not just aging.	Yeah, OP's friend is completely wrong. 
Is the host lady related to mother Chantall? 	No, but she did go to the Barbizon School for Hosting...
What kind of shoes are you looking for? I am wearing my cowboy boots 	Love cowboy boots! I'll probably go with a lower heel or a wedge. I was thinking blush-colored because I have a pink ribbon around my waist. I also love glitter or velvet. There are just so many choices.
Has anyone called him Gabewad yet?	Well she’s gonna be screaming it tonight.
A low-key argument for QB wins. When Eli plays great, the team wins the Super Bowl. When Eli plays poorly, the team is doomed.	Wasn't Eli widley considered the only Giant who played well in their recent loss?
Looks stoned	he loves grass
I’ve always wondered what was the dragon made out of. Chakra? Or the red vapor??	Guy's Blood. That vapor is his blood.
Um, what happened to the bus only lane on Rhode Island Ave NE?  Seems like business as usual this AM.	Some info in this [post](https://ggwash.org/view/68446/little-enforcement-on-the-temporary-bus-only-lane-installed-to-ease-red-line-shutdowns). 
I won a lifetime supply of **coffee beans** in a contest. Each month they mail 4 lbs. of excellent quality coffee beans of my choice. Sometimes I give them away as gifts as I can't use them all.	That is amazing. I miss drinking coffee so bad. :( 
I wonder if the guy in the picture is taking the picture. 	I kind of hope not
I don’t trust anyone in this game, so i can’t trust this	I can guarantee that this will work. I tried it on my sloop, my friend's slop, and then again on another occurrence when I found another chest of sorrow. It will work
Lot of gaming hardware comes with the ability to program a series of actions into one button click. That's all it is, just makes it virtually instant in armlet toggling or selecting meepos and poofing.	oh so like instead of selecting meepos with alt+1/2/3/4 it just scrolls through them instantly?
You have 9 already	Wow. I just realized that now. Thanks
Ew no, don't make me look at my water grid	Yeah, built 5\* Uno and I still think it might be my worst team...
14 man ppr. Without knowing team needs and lineups would you do either of these trades? Give- Melvin Get- godwin, Chubb, late 2019 first  Or Give- kamara, 2019 2nd Get- cooks, Chubb, tawayn Taylor My team does have a pretty stacked lineup but my bench players are rough and probably not startable	I'd pass on both trades
Why would these former employees have any clearance beyond that of an average citizen?	That's just how clearnaces work. You keep the clearances after you leave the job for some reason. That's how veterans usually find work, because they're about the only people out there who can be hired for clearance work and already have the clearance.
Are we trying to get the game earlier or patch notes earlier? Lol	Yes
It's your fault firstly for supporting this kind of behavior from companies, never pre-order, even if you are going to cancel it later.	Yea, I do agree with you, I normally don't get preorders.  
Honestly if you have high stats and weak ecs the decision probably depends on your essay! I go to UCLA now and i remember thinking wow I don't know how I am going to make myself sound special and struggling with my essays.  If you want someone to look at your essay email me [kimy97@g.ucla.edu](mailto:kimy97@g.ucla.edu) 	Bit late to the party but if you could PM me your essays that would be great!
What is happening? Is Angela bonding with Kaitlin right now?! 😮😂	Kaitlyn is not a threat to win, but she is not someone I'd want to see on the block against either.
The cult summoned a demon. And now it's after *them*.	They have chosen the name of the destructor.
'Trumps top economic adviser' is a euphemism for 'some guy'	Could also be a gal, unfortunately it won't ever be a euphemism for 'someone competent'.
Feel ya, we usually don't think of it as promoting "smaller" people though. We love doing the Bonuses over regular episodes with certain guests, because they lend themselves to uninterrupted and relaxed conversations way more, since there's no ads. Wasn't out of disrespect to him or you guys.	No disrespect felt, and i see your point and definitely agree that he was a definitely good choice for an uninterrupted ep.
I like Casino more than goodfellas, sue me	Subpoena is in the mail and I will see you in court good sir 
Didn’t realize Carlton stole his signature dance from our Lord and Savior... 	Now the lyrics make sense. It's not unusual to be loved by any One.
Man, that keyboard must be Heaven to type on!	I haven't done much more than getting through the time and date setup, but once I clean it up and get a new HDD/CF adapter and a DOS 5.0 floppy I plan to do some serious typing on it.
She wasnt the love of your life. The love of your life is still searching for you.	Realizing this really helped me get through my last breakup with the woman I wanted to marry.
11:05 no NEXT :(	May take awhile for the update to.be rolled out.  Give it a bit.
INB4 300 comments of "harassing somebody is obviously wrong... *but...*"	AKA OP two posts down. 
Nice work! You look great!	Thank you!
Absolutely no correlation. Plus this is my fourth pregnancy and I had zero morning sickness with 2 of them, just a tiny bit early on with 1 and hg with 1 so there's not even a correlation between them.	As a ftm who had severe HG for 12 weeks you give me hope. 
Let her know that it would be good for you her and everybody if she tended to her own needs. Sometimes for a 2 you May have to trick them to take care of themselves by referencing the other that they put so much into 	Thanks, that means a lot coming from actual 2.
I design and sell items used in virtual communities.  I just whip it up in Blender, and go to a marketplace on Second Life, or InWorlds, or a few other online virtual places and sell them.  I don't make tons of money (though some people do) but I make enough to buy myself some toys every once in a while.  A new guitar, new computer, a gamestation, yadda yadda.  	Would a modeling program like SolidWorks work for this too? I've made some decent looking stuff in SW before. ~~Is there a website that you can sell the models on?~~ Just saw the answer to this in another comment.
Despite him saying he will do a birthday stream (said that before this lucy drama happened) I doubt he will do one now. It would be a shitshow, on his birthday. Doubt he will want to do that. Will proabably tweet he is taking the night off to enjoy his final birthday hours. If he DOES do it, chat will be filled will questions, and he will be scrambling to answer them and shrug them off, or just do a pure game stream like last time where he just played WoW constantly and didnt talk about his life at all. I expect all his streams from now on, to be radio silent on his life, and will just be his fat face playing games all night and only stopping to read off his subs and thank the kids for taking their lunch money so he can get fatter.	If he does a stream and says anything of note I hope someone archives it in case he deletes the VOD
&gt; Japan-Germany symposium The last one they had didn't end well	hopefully this one will turn out alreich
i dont watch for the lore primarily and honestly that isnt what the show is geared toward really it would lose alot of identity of the predecessor 	Hey, TheCrystalJewels, just a quick heads-up: **alot** is actually spelled **a lot**. You can remember it by **it is one lot, 'a lot'**. Have a nice day! ^^^^The ^^^^parent ^^^^commenter ^^^^can ^^^^reply ^^^^with ^^^^'delete' ^^^^to ^^^^delete ^^^^this ^^^^comment.
Just finished a 10.2-mile run. I was planning another 3 miles, but my legs decided it was time to quit. So I had to do a 1-mile walk-of-shame back home alongside a busy road :(	I burned ~1200-1900 calories (depending on if Strava with a heart rate monitor is to be believed). This means I can eat a bucket of fried chicken, right? Right?
It's a better return but not mindblowing. The Mets retaining none of Familia's salary is worse. 	Wait, what?
I think an E damage nerf with increased damage to jungle monsters along with a buff to W damage would be better. Bc fiddle would miss having the damage on E against some camps	Allow E to bounce off himself if first target was a large monster
Wait is that chocola?	No it's a karate girl
Did anyone else notice the sound of the pumps kicking in just be for ignition?	Wow, I just went back and heard it. That sounds so cool!
Hahahaha, brilliant! xD	What is the airspeed velocity of an unladen swallow ?
How much did they need to pay the guy driving the truck?	I think the going rate is 72 virgins
These are the QC  vids Peltiano has sent me ... Front - https://www.youtube.com/watch?v=LAEywS7ZfwQ Back - https://www.youtube.com/watch?v=5SgdxwV12lc&amp;feature=youtu.be he advised the neck tags will be added before shipping and he is going to send out pictures when its done .	That looks pretty good. Fabric seems thick as retail
Ending scene in Silent Voice 	Not just the ending scene, honestly.
I heard the power up by Duffy's is back, but I talked to Janet and she said her power's not back yet :-/	Well maybe if Janet would unplug those Christmas lights her power would be on. I know that they aren't turned on, but I'm telling you they draw power even if they are just plugged in.
You really should link the original thread but that is a fantastic rendition of poor Barnaby.	It took me a sec to copy over the links. OP was nice enough to let me share. The original thread is full of goodies.
A bit of dry ice there would have gone a long way in improving the presentation	Maybe some disco lights too. 
Sick collection man! Where to buy the poster? it looks cool.	The name of the artist is [Kehasuk](https://www.kehasuk.com/). He only does a sale online 4 times a year. Next day is August 1st. 
What time?	First thirty seconds
I bought STW just a couple of days ago before the release of the skins. I’m addicted to it now. I rarely play BR now.	Same situation for me
Wow, that child couldn't catch that toss? DFA them immediately.	That's Teo's kid
My friend and I were camping in Big Sur and thought it was a giant meteor breaking up in the atmosphere. 	funny enough it ended up being something leaving the atmosphere, not entering it! 
* Sonarr * Radarr * Plex * OpenVPN * DDNS In no particular order. 	What is Sonarr?  I checked the website and read the FAQ and I'm still not sure.  Something like sickbeard to make torrenting easier? radarr has even less information on what it does.
Why is this thread so huge? It honestly seems bizarre to me that we're all so invested in a change in one person on the social media team. Like, there's 136 comments on this thread and about 24 on the one about how the team hired a bunch of new scouts and promoted a key person in the organization. 	It's July. Why are any of us posting on here at all? I don't want to wish the summer away... but I'd sure like to watch some hockey.
I don't get much vapor at ~380 degree Temps for the first few pulls, you'll definitely get effects though it's just invisible vapor at first. 	If you really want to see clouds get a water pipe adapter and run the CFX at 430 degrees. But be warned this will send you to the moon haha
Tfw you'll never get your neck licked by Rize-san	[Feels bad](https://mobile.twitter.com/sotonami/status/592404488557760512) 
I’ll agree once liberals and succ dems stop glorifying FDR on here. 	I haven’t seen anyone on here do that. 
The great r/adelaidefc schism that resulted in us now having two subreddits... 	&gt;The great r/adelaidefc ~~schism~~ expansion
We will never know if it was sheer luck, or that he was really counting the timer of Brewmaster's ult.	could have been a bit of both tbh - not exactly counting it but he probably has an internal clock better than ours at counting that type of stuff subconsciously then just hooked when it felt right.
They don't. They absolutely could unlock another car of the same model. I believe Nissan has gone on record to say that they have something like only 3,000 (might've been 30,000) unique key configurations. So odds are you could find another car you could unlock. But unlocking a car is all you could do, since many car keys nowadays make use of transponders to prevent someone else's key from starting the engine.	My dad had a Nissan truck in the late 90's &amp; we could unlock pretty much every single other Nissan truck of the same model, they never started, but we never once found one we couldn't unlock.
Came through here before. Assumes no gloves or very short gloves, and is a big risk of wrist fracture in a crash.	Just appreciate a nifty idea without tearing it apart. Keep the good vibes up
Who keeps a yacht in Ohio?	I’m assuming it’s docked up on the Great Lakes? 
He had to do it to em	"Rulaoonga mein inko, inko taqleef ponchegi"
You should've sent me a WUPHF.	WUPHF was my idea.  I think I'm going to sue you.
“Every professor and prominent intellectual?” 🤔	Able to corroborate Source: am every professor and intellectual.
For me tolerance takes a long time.  Also the more food I eat in the day or night before affects the strength of kratom.	less food makes it hit harder or less?
Congratulations! Looks like a great find 	Thank you! I’m real excited to drive it! 
Kicking myself so hard for not buying more before the swap...oh well I guess I'll hopefully see some green soon if we can hit $.0485	I want to go in for more, but now the question is will the "pullback" price be higher than where it is right now?
Hut take: People who own reptiles larger than a microwave are lunatics and can't be trusted. 	Why is the microwave your unit of measurement? 
banned	reported
Why is your smile this }	He's trying to include information that isn't important, such as that nose.
You don’t know true power until you run Stevens DB with Sawed Off	This loadout is even more powerful with slugs equipped on both of the Db and sawed off
LPT: Put a paper towel in with your Costco sized spinach to make it last literally another 1 to 2 weeks. Huge saver for me. 	I do this with all my fresh fruit and veggies. It really does make a difference. Now, if you'll pardon me, I do believe I have some limp dill that needs to be put in the freezer, at the suggestion of a kind Redditor.
Never heard anyone that spells doodle as doddle. Good drawing tho	Ahhhhh I just noticed! It was late in my country and I was sleepy! (Yes, this is totally a solid excuse)
This making me realize it’s going to take ages to crown someone can’t wait for round 1000	We have a long off season. Also it seems like it will gradually be revealed like 100-90 then few more quizzes here’s 90-80 more quizzes 80-70 etc
0 Resprings so far with mitshuaXI.	I have MitsuhaXI and Artsy installed and have no random resprings
Same here. But not just the event, other reputation projects as well. It worked for a moment when I went somewhere else (sorry I don't remember) but when I changed captains it happened again.	It’s possible the marks are being dumped into overflow, check your inventory and see if your inventory is full and if not then check the overflow bag.
I know it doesn't help, but im having the same issue	I'm having the same issue also. Edit - Made the second choice (my charisma was high enough) and hit Skip and it got me through.
Even yugioh has its mecha bunny that summon itself two times. It is a pretty common thing in the pop culture	Yes but are they on a Pogo stick ? 
Going to be downvoted for this, but the Myers/Briggs personality test has been highly discredited and isn't a meaningful indicator of personality types.	It is a meaningful indicator of Personality types. I wouldn’t recommend using it to hire someone, or choose a significant other, or really to make any decisions in your life, but it is a proven model in 3 main categories. Look it up.  
I'm in Milan the week of the derby. Inter are the home team, but I prefer Milan, so I would rather sit in the Milan end. How easy is it going to be to get tickets?	Not easy
Serious talk: You should've left at least a couple for other emergencies. You never know when you'll need em.	Or that the first couple of days could be rough before patches are made. 
Expecting a full send on this continued bull run after futures contracts end later today. 	Futures volume is pathetic compared to average daily volume of Bitcoin. When will people realize futures expirations have very little affect on BTC price?!
Sold xda godspeed to /u/Rukudo	Confirmed
I love every time a WLIIA post comes up because the comments are always filled with peoples best bits and its awesome.	/r/wholesomememes
These plushies are...bad...really bad. 	Not to mention she forgot to buy Puppet.
As a goalie I can't figure out how to change my catching clove . It's on the right hand. I want it on left.but can't find it. Any one know? Thanks. 	Where you set your load out. You can change type of goalie, height, weight and hand
To everyone who thinks this is wrong, let’s try a different proof. 3 * 1/3 = 1 (no one argues this) But if we put this in decimal form, 3 * 0.333.. = 0.999.. See it now?	9x is the problem i see
So, is she being groomed for 2020? She seems to be showing up constantly in headlines, for almost everything she does. Further, her endorsement seems to be kicking up funding for other progressive dems, and she's been partnering with Sanders for that purpose. Just makes me wonder if there's a reason every thing she does is generating news. This isn't a criticism of her or her policies. There's literally like 2-3 headlines mentioning her between top and new right now.	Democrat leadership is non-existent is why. People clamor for responses to what bother them, and people will fill that gap increasingly until the Democratic Party is a non-entity.
LOL, wife's reaction was the best part. 	The husband’s reaction to the wife’s reaction.
Well, you rock them!!	thank you!
The sound effect from the sunlight damage made it even better.	***Is there something I can do for you?***
For all the true fans out there, here's a [bonus pic](https://i.imgur.com/NjKhv3A.png)	Even better
&gt;created by higher intelligence to terraform the Earth. Biological Life is the ultimate technology.	I agree. What I wonder is if it's something that developed naturally or if it has had some help along the way. 
I like it😈⚔️🖤	Thank you!! 
Antimeme 	Welcome to r/bonehurtingjuice
thanks	no problem.
Dwayne Johnnson	I don't think you can call him washed up, if he is starring in every top blockbuster and getting great reviews. he in like 3 movies a year. 
eating sashimi (if you enjoy raw fish), or naruto style (wrapped in cucumber &amp; seaweed) are the most keto friendly. I'm still finding a perfect cauliflower rice cooking method that can act as a rice substitute for sushi rolls (last few we've made have fallen apart)	oooooh I was thinking about that the other night when i was making cauli rice- be sure to let us know if you figure something out :o
